"De la pousse à l'assiette";"Non";"1708";"";"";"Duo de Micro pousses corsé  1 coriandre et un corsé  1 coriandre et 1 variété surprise corsée";"GD-MN-UUN-NN";"Légumes frais";"2.24";"2.80";"barquette";"4";
"De la pousse à l'assiette";"Non";"1709";"";"";"Duo de Micro pousses Fort et Doux";"GD-MN-UUN-NN";"Légumes frais";"2.24";"2.80";"barquette";"4";
"De la pousse à l'assiette";"Non";"1711";"";"";"Lot de 4 Micro pousses de tournesol, basilic,persil et une variété de pousse  découverte";"GD-MN-UUN-NN";"Légumes frais";"4.00";"5.00";"barquette";"4";
"De la pousse à l'assiette";"Non";"1731";"";"";"Micro pousses de Brocoli  en bac de 14 *19 cm très dense";"GD-MN-UUN-NN";"Légumes frais";"4.40";"5.50";"barquette";"0";
"De la pousse à l'assiette";"Non";"1732";"";"";"Micro pousses de Tournesol  en bac de 14 *19 cm très dense";"GD-MN-UUN-NN";"Légumes frais";"4.40";"5.50";"barquette";"1";
"De la pousse à l'assiette";"Non";"1733";"";"";"Micro pousses de Lentilles Corail  en bac de 14 *19 cm très dense";"GD-MN-UUN-NN";"Légumes frais";"4.40";"5.50";"barquette";"1";
"DOMAINE de Canta Rainette";"Oui";"120";"3000001234654";"";"Vin Côtes de Provence BLANC, Origines  Origine Domaine de Canta Rainette (bouteille)";"SA-RO-UUN-NN-P";"Boissons";"6.00";"7.20";"";"18";
"DOMAINE de Canta Rainette";"Oui";"121";"3000001234661";"";"Vin Côtes de Provence ROUGE Grande réserve Domaine de Canta Rainette (bouteille)";"SA-RO-UUN-NN-P";"Vins et bières";"7.70";"10.40";"";"1";
"DOMAINE de Canta Rainette";"Oui";"122";"3000001234678";"";"Vin ROUGE Cuvée Armony en cubi 5 litres";"SA-RO-UUN-NN-P";"Vins et bières";"14.50";"18.80";"litre";"9";
"DOMAINE de Canta Rainette";"Oui";"1161";"";"";"Vin ROSE AOP CANTA RAINETTE, Cuvée éphémère en cubi 5 litres";"SA-RO-UUN-NN-P";"Boissons";"20.50";"25.00";"litre";"3";
"DOMAINE de Canta Rainette";"Non";"123";"3000001234685";"";"Vin ROSE cuvée Aurore en cubi 5 litres";"SA-RO-UUN-NN-P";"Vins et bières";"14.50";"18.80";"litre";"20";
"DOMAINE de Canta Rainette";"Non";"410";"";"";"Vin Côtes de Provence Rosé cuvée Divine Domaine de Canta Rainette (bouteille)";"SA-RO-UUN-NN-P";"Vins et bières";"5.30";"6.70";"";"0";
"DOMAINE de Canta Rainette";"Non";"840";"";"";"Vin Côtes de Provence ROUGE  Domaine de Canta Rainette (bouteille)";"SA-RO-UUN-NN-P";"Vins et bières";"7.70";"9.90";"";"0";
"Domaine Fontaine des fées";"Oui";"842";"3000001234708";"";"Vin Côtes du Rhône village Rouge Domaine Fontaine des fées (BIO)";"SA-RO-UUN-NN-P";"Boissons";"6.60";"7.20";"Bouteille de 75 cl";"1";
"Domaine Fontaine des fées";"Non";"841";"3000001234692";"";"Vin Côtes du Rhône BLANC Domaine Fontaine des fées (BIO)";"SA-RO-UUN-NN-P";"Boissons";"6.00";"6.90";"Bouteille de 75 cl";"0";
"DOMAINE Pastouret vin BIO";"Non";"157";"";"";"Vin ROUGE BIO Costières de Nîmes CUVEE MICHEL";"SA-RO-UUN-NN-P";"Vins et bières";"3.60";"4.80";"";"-1";
"DOMAINE Pastouret vin BIO";"Non";"158";"";"";"Vin ROUGE BIO Costières de Nîmes CUVEE DE MATHIEU ";"SA-RO-UUN-NN-P";"Vins et bières";"4.20";"5.70";"";"0";
"DOMAINE Pastouret vin BIO";"Non";"159";"";"";"Vin ROUGE BIO Costières de Nimes en box de 5 litres";"SA-RO-UUN-NN-P";"Vins et bières";"11.95";"15.00";"";"0";
"DOMAINE Pastouret vin BIO";"Non";"435";"";"";"Vin Blanc BIO Costières de Nîmes CUVEE JEANNE";"SA-RO-UUN-NN-P";"Vins et bières";"3.60";"4.80";"";"3";
"Earl Le Plumet";"Non";"1390";"";"";"Noix Grenoble Bio  (au Kg)";"DF-RO-KUN-NO-P";"Fruits secs";"4.80";"5.90";"Kg";"0";
"Earl Le Plumet";"Non";"1391";"";"";"Noix Grenoble Bio  par 5Kg";"DF-RO-KUN-NO-P";"Fruits secs";"24.00";"28.50";"5Kg";"0";
"Echange Paysan 05 - C&E";"Oui";"1306";"3443860002017";"";"Yaourt Fermier Nature 125G  à l'unité. Echange Paysans";"CR-RO-UUN-NN";"Fromages et Crèmerie";"0.26";"0.35";"";"6";
"Echange Paysan 05 - C&E";"Oui";"1313";"3456570000020";"";"Fromage Blanc  fermier 40%  Pot 1 Kg. Echange Paysans";"CR-RO-UUN-NN";"Fromages et Crèmerie";"3.20";"4.30";"";"2";
"Echange Paysan 05 - C&E";"Oui";"1314";"3456570000174";"";"Lait entier pasteurisé Bouteille 1 L . Echange Paysans";"CR-RO-UUN-NN";"Fromages et Crèmerie";"1.30";"1.70";"";"2";
"Echange Paysan 05 - C&E";"Oui";"1315";"3770014850010";"";"Jus  Poire 1L  Echange paysans";"DJ-RO-UUN-NN-P";"Jus de fruits";"2.37";"3.00";"Litre";"6";
"Echange Paysan 05 - C&E";"Oui";"1317";"3770014850034";"";"Jus de pomme coing 1L Echange paysans";"DJ-RO-UUN-NN-P";"Jus de fruits";"2.37";"3.00";"Litre";"1";
"Echange Paysan 05 - C&E";"Oui";"1342";"";"";"Fromage Blanc 1 Kg   au Lait Cru Bio Echanges Paysans";"CR-RO-UUN-NN";"Fromages et Crèmerie";"4.42";"5.50";"";"2";
"Echange Paysan 05 - C&E";"Oui";"1343";"";"";"Pyramide cendrée affinée 160 g Bio Echanges Paysans";"CR-RO-UUN-NN";"Fromages et Crèmerie";"3.30";"4.40";"";"3";
"Echange Paysan 05 - C&E";"Oui";"1345";"";"";"Vin Domaine de la Grande Hauche Blanc Bib 3l Bio";"SA-RO-UUN-NN-P";"Boissons";"14.76";"18.45";"";"2";
"Echange Paysan 05 - C&E";"Oui";"1346";"3416604103004";"";"Vin Domaine de la Grande Hauche Rouge Bib 3l Bio";"SA-RO-UUN-NN-P";"Boissons";"14.76";"18.45";"";"1";
"Echange Paysan 05 - C&E";"Oui";"1347";"3416604203001";"";"Vin Domaine de la Grande Hauche Rosé Bib 3l Bio";"SA-RO-UUN-NN-P";"Boissons";"14.76";"18.45";"";"6";
"Echange Paysan 05 - C&E";"Oui";"1374";"3456570000129";"";"Yaourt fermier aux arômes naturels de vanille 125G  à l'unité. Echange Paysans";"CR-RO-UUN-NN";"Fromages et Crèmerie";"0.40";"0.55";"";"4";
"Echange Paysan 05 - C&E";"Oui";"1528";"3456570000235";"";"Yaourt Bi-couche Crème de Châtaignes 125G  à l'unité. Nouveau Echange Paysans";"CR-RO-UUN-NN";"Fromages et Crèmerie";"0.44";"0.60";"";"16";
"Echange Paysan 05 - C&E";"Oui";"1572";"3456570000082";"";"Tomme de la blanche affinée au lait cru 130G pré emballé Echanges Paysans";"CR-RO-UUN-NN";"Fromages et Crèmerie";"1.54";"2.05";"";"1";
"Echange Paysan 05 - C&E";"Oui";"1610";"";"";"Bière La Sorcière Blonde 5° bouteille 75cl Bio";"SA-SI-UUN-NN-P";"Boissons";"4.52";"5.65";"";"7";
"Echange Paysan 05 - C&E";"Oui";"1690";"";"";"Taillon  250 g environ au lait cru  Echanges Paysans payé au poids";"CR-RO-KQN-NO";"Fromages et Crèmerie";"3.20";"4.45";"";"5";
"Echange Paysan 05 - C&E";"Oui";"1734";"";"";"Jus  Poire Coing 1L  Echange paysans";"DJ-RO-UUN-NN-P";"Jus de fruits";"2.37";"3.00";"Litre";"5";
"Echange Paysan 05 - C&E";"Oui";"1746";"";"";"Yaourt nature bio 500g pot en verre. Echange Paysans";"CR-RO-UUN-NN";"Fromages et Crèmerie";"2.36";"3.00";"";"1";
"Echange Paysan 05 - C&E";"Oui";"1804";"";"";"Saucisson aux Noisettes – Le noisetier 200 g environ Echanges Paysans";"PC-RO-UUN-NN";"Viandes et Poissons";"3.02";"3.80";"";"8";
"Echange Paysan 05 - C&E";"Oui";"1805";"2449852000000";"";"Saucisson aux Noix  Le gourmand 200 g environ Echanges Paysans";"PC-RO-UUN-NN";"Viandes et Poissons";"3.02";"3.80";"";"8";
"Echange Paysan 05 - C&E";"Oui";"1836";"";"";"Buchette affinée 230g g Bio Echanges Paysans";"CR-RO-UUN-NN";"Fromages et Crèmerie";"3.43";"4.60";"";"0";
"Echange Paysan 05 - C&E";"Oui";"1837";"";"";"Saucisson Le fermier Alpin 250 g environ Echanges Paysans";"PC-RO-UUN-NN";"Viandes et Poissons";"3.02";"3.80";"";"6";
"Echange Paysan 05 - C&E";"Oui";"1838";"3770014850065";"";"Jus de pomme  raisin 1L  Echange paysans";"DJ-RO-UUN-NN-P";"Jus de fruits";"2.38";"3.10";"Litre";"3";
"Echange Paysan 05 - C&E";"Oui";"1839";"";"";"Tome Fleurie de brebis . Portion de 200 G environ  Echange Paysan";"CR-RO-PQN-OO-S";"Fromages et Crèmerie";"3.62";"4.50";"";"11";
"Echange Paysan 05 - C&E";"Oui";"1851";"";"";"Coulis de Ketchup Bio 59 cl Echange paysans";"SC-RO-UUN-NN-P";"Epicerie salée";"3.15";"3.95";"Litre";"6";
"Echange Paysan 05 - C&E";"Non";"1305";"";"";"Faisselles 100 g 40 % à l'unité Echange Paysans";"CR-RO-UUN-NN";"Fromages et Crèmerie";"0.50";"0.65";"";"0";
"Echange Paysan 05 - C&E";"Non";"1307";"3456570000204";"";"Crème dessert café  125 G  à l'unité. Echange Paysans";"CR-RO-UUN-NN";"Fromages et Crèmerie";"0.45";"0.60";"";"6";
"Echange Paysan 05 - C&E";"Non";"1308";"3456570000181";"";"Crème dessert chocolat 125 g à l'unité. Echange Paysans";"CR-RO-UUN-NN";"Fromages et Crèmerie";"0.45";"0.60";"";"-3";
"Echange Paysan 05 - C&E";"Non";"1309";"";"";"Yaourt aromatisé caramel au lait entier  125 G  à l'unité. Echange Paysans";"CR-RO-UUN-NN";"Fromages et Crèmerie";"0.37";"0.55";"";"0";
"Echange Paysan 05 - C&E";"Non";"1310";"3456570000228";"";"Yaourt bi-couche framboise  125 G à l'unité. Echange Paysans";"CR-RO-UUN-NN";"Fromages et Crèmerie";"0.44";"0.60";"";"0";
"Echange Paysan 05 - C&E";"Non";"1311";"";"";"Tome Capritte au lait de chèvre. Portion de 200 G environ  Echange Paysan";"CR-RO-PCN-OOS";"Fromages et Crèmerie";"3.22";"4.00";"";"-1";
"Echange Paysan 05 - C&E";"Non";"1316";"";"";"Jus de pomme  cerise 1L  Echange paysans";"DJ-RO-UUN-NN-P";"Jus de fruits";"2.38";"3.10";"Litre";"0";
"Echange Paysan 05 - C&E";"Non";"1341";"";"";"Faisselle de Vache au lait cru pot individuel 125 g Bio Echanges Paysans";"CR-RO-UUN-NN";"Fromages et Crèmerie";"0.64";"0.85";"";"0";
"Echange Paysan 05 - C&E";"Non";"1344";"3456570000044";"";"Fromage frais en faisselle 100 g Echanges Paysans";"CR-RO-UUN-NN";"Fromages et Crèmerie";"0.53";"0.70";"";"0";
"Echange Paysan 05 - C&E";"Non";"1373";"3443860002116";"";"Yaourt Bi-couche Crème de Châtaignes 125G  à l'unité. Echange Paysans";"CR-RO-UUN-NN";"Fromages et Crèmerie";"0.44";"0.60";"";"3";
"Echange Paysan 05 - C&E";"Non";"1375";"";"";"Fromage Raclette L'Estoilie 250 G environ Echange Paysans";"CR-RO-UUN-NN";"Fromages et Crèmerie";"3.32";"4.45";"";"0";
"Echange Paysan 05 - C&E";"Non";"1461";"";"";"Yaourt Brebis Nature Fermier Bio 125 G. Echange Paysans";"CR-RO-UUN-NN";"Fromages et Crèmerie";"0.98";"1.30";"";"0";
"Echange Paysan 05 - C&E";"Non";"1462";"3701259600269";"";"Faisselle Brebis  Fermiere Bio 100 G. Echange Paysans";"CR-RO-UUN-NN";"Fromages et Crèmerie";"0.96";"1.30";"";"0";
"Echange Paysan 05 - C&E";"Non";"1480";"";"";"Fromage Marchou Frais de Brebis Bio 150 g Echange Paysan";"CR-RO-UUN-NN";"Fromages et Crèmerie";"2.51";"3.10";"";"0";
"Echange Paysan 05 - C&E";"Non";"1529";"";"";"Yaourt Nature fermier. Nouveau Echange Paysans";"CR-RO-UUN-NN";"Fromages et Crèmerie";"0.30";"0.40";"";"0";
"Echange Paysan 05 - C&E";"Non";"1530";"";"";"Bleu pré emballé au lait cru Bio Echanges Paysans";"CR-RO-UUN-NN";"Fromages et Crèmerie";"3.08";"4.10";"";"1";
"Echange Paysan 05 - C&E";"Non";"1597";"3443860002024";"";"Yaourt Bi-couche Citrons 125G  à l'unité. Echange Paysans";"CR-RO-UUN-NN";"Fromages et Crèmerie";"0.41";"0.55";"";"0";
"Echange Paysan 05 - C&E";"Non";"1598";"";"";"Yaourt Bi-couche Fraise 125G  à l'unité. Echange Paysans";"CR-RO-UUN-NN";"Fromages et Crèmerie";"0.41";"0.55";"";"8";
"Echange Paysan 05 - C&E";"Non";"1710";"";"";"Petit mi-frais L'Alpin bio au lait cru de Brebis 120g . Echange Paysans";"CR-RO-UUN-NN";"Fromages et Crèmerie";"2.83";"3.75";"";"0";
"Echange Paysan 05 - F&L";"Oui";"1319";"";"";"Pommes Gala Démarche éco responsable";"FD-MN-KUN-NO-P";"Fruits frais";"1.42";"1.80";"kg";"1";
"Echange Paysan 05 - F&L";"Oui";"1762";"";"";"Oignons rouges frais (au 500G)   Echange Paysans- Sandrine Turrel";"LB-MO-KMN-NO";"Légumes frais";"1.27";"1.60";"kg";"0";
"Echange Paysan 05 - F&L";"Oui";"1823";"";"";"Pomme Opale Bio au Kg";"FP-MN-KUN-NO";"Fruits frais";"2.28";"2.85";"kg";"2";
"Echange Paysan 05 - F&L";"Non";"188";"";"";"Haricots verts fins  extra  Bio au 100g Echanges Paysans";"LG-MV-KDN-NO-P";"Légumes frais";"0.57";"0.75";"kg";"0";
"Echange Paysan 05 - F&L";"Non";"1318";"";"";"Prunes bleues Président  au 500 g   Démarche éco responsable. Échange paysans";"FD-MN-KMN-NO-P";"Fruits frais";"0.93";"1.25";"kg";"0";
"Echange Paysan 05 - F&L";"Non";"1320";"";"";"Poires William au KG Démarche éco responsable";"FD-MN-KUN-NO-P";"Fruits frais";"1.42";"1.90";"kg";"0";
"Echange Paysan 05 - F&L";"Non";"1321";"";"";"Poivrons Verts carré Bio par 500G   Echange Paysans";"LF-MN-KMN-NO-P";"Autres légumes";"1.70";"2.15";"kg";"0";
"Echange Paysan 05 - F&L";"Non";"1322";"";"";"Tomates Roma Bio au KG- Echange Paysans";"LT-MV-KUN-NO";"Tomates";"2.00";"2.50";"";"0";
"Echange Paysan 05 - F&L";"Non";"1324";"";"";"Blettes Bio par 500g Echange Paysans";"LS-MN-KDN-NO";"Légumes frais";"1.25";"1.60";"kg";"0";
"Echange Paysan 05 - F&L";"Non";"1422";"";"";"Poires Louise Bonne au Kg AR par Echange Paysans";"FP-MN-KUN-NO";"Pommes et poires";"1.42";"1.90";"kg";"1";
"Echange Paysan 05 - F&L";"Non";"1431";"";"";"Poires Xénia au Kg  Bio par Echange Paysans";"FP-MN-KUN-NO";"Pommes et poires";"2.29";"3.05";"kg";"0";
"Echange Paysan 05 - F&L";"Non";"1432";"";"";"champignons Pleurotes Gris Bio (au 100G)  par Echange Paysans";"LX-MN-KDO-NO";"Autres légumes";"1.09";"1.45";"100 g";"0";
"Echange Paysan 05 - F&L";"Non";"1507";"";"";"Pommes Golden Agric raisonnée sans résidus (Kg)";"FP-MO-KUN-NO";"Pommes et poires";"1.21";"1.50";"kg";"998";
"Echange Paysan 05 - F&L";"Non";"1508";"";"";"Pommes Fuji Agric raisonnée (au Kg)";"FP-MO-KUN-NO";"Pommes et poires";"1.21";"1.50";"Kg";"0";
"Echange Paysan 05 - F&L";"Non";"1509";"";"";"Pommes Pink Zéro résidus(au kg)";"FP-MO-KUN-NO";"Fruits frais";"1.21";"1.50";"KG";"0";
"Echange Paysan 05 - F&L";"Non";"1531";"";"";"Pommes Idared Agriculture sans résidus calibre 150 170 G (au kg)";"FP-MO-KUN-NO";"Fruits frais";"1.21";"1.50";"KG";"0";
"Echange Paysan 05 - F&L";"Non";"1688";"";"";"Cerises (au 500G)   Echange Paysans- EARL Gold Api";"FD-MN-KMN-NO-P";"Fruits frais";"2.27";"3.05";"kg";"7";
"Echange Paysan 05 - F&L";"Non";"1754";"";"";"Pêches blanches (au 500G)   Echange Paysans- EARL Jacob";"FD-MN-KMN-NO-P";"Fruits frais";"1.35";"1.80";"kg";"1";
"Echange Paysan 05 - F&L";"Non";"1764";"";"";"Prunes Jaunes  Golden Japan (au 500G)   Echange Paysans- EARL Gold'Api";"FD-MN-KMN-NO-P";"Fruits frais";"0.85";"1.15";"kg";"1";
"Echange Paysan 05 - F&L";"Non";"1792";"";"";"Pomme Lafayette Bio au kg nouvelle récolte 2020";"FD-MN-KUN-NO-P";"Pommes et poires";"2.28";"2.85";"kg";"1";
"Echange Paysan 05 - F&L";"Non";"1793";"";"";"Pêches Jaunes (au 500G)   Echange Paysans- EARL Jacob";"FD-MN-KMN-NO-P";"Fruits frais";"1.35";"1.80";"kg";"0";
"Echange Paysan 05 - F&L";"Non";"1803";"";"";"Haricots Coco récoltés à la main  Bio au 100g Echanges Paysans";"LX-MN-KDO-NO";"Légumes frais";"0.68";"0.85";"kg";"0";
"Echange Paysan 05 - F&L";"Non";"1807";"";"";"Poires Guyot au Kg AR par Echange Paysans";"FP-MN-KUN-NO";"Pommes et poires";"1.42";"1.90";"kg";"0";
"Echange Paysan 05 - F&L";"Non";"1809";"";"";"Pomme Crimson Crisp Bio au Kg";"FP-MN-KUN-NO";"Fruits frais";"2.28";"2.85";"kg";"-1";
"Echange Paysan 05 - F&L";"Non";"1822";"";"";"Poires Conférence  au Kg  AR par Echange Paysans";"FP-MN-KUN-NO";"Fruits frais";"1.42";"1.90";"kg";"1";
"ECOGERME SA";"Non";"126";"3683080002545";"";"Graines germées MELANGE DETOX";"SS-RV-UUN-NN-S-G";"Graines germées";"2.11";"2.65";"";"100";
"ECOGERME SA";"Non";"127";"3683080002545";"";"Graines germées de TREFLE POURPRE.";"SS-RV-UUN-NN-S-G";"Graines germées";"2.11";"2.65";"";"100";
"ECOGERME SA";"Non";"128";"3683080002545";"";"Graines germées MELANGE VITALITE.";"SS-RV-UUN-NN-S-G";"Graines germées";"2.11";"2.65";"";"100";
"ECOGERME SA";"Non";"517";"3683080002545";"";"Graines germées ALFALFA";"SS-RV-UUN-NN-S-G";"Graines germées";"2.11";"2.65";"";"99";
"Epice Scop";"Oui";"1083";"3760147070041";"";"Chocolat au lait El Inti BIO 100g";"DC-RO-UUN-NN-P";"Accueil";"2.30";"2.90";"";"11";
"Epice Scop";"Oui";"1084";"3760147070058";"";"Chocolat au lait et aux amandes El Inti BIO 100g";"DC-RO-UUN-NN-P";"Accueil";"2.47";"3.10";"";"19";
"Epice Scop";"Oui";"1085";"3760147070430";"";"Chocolat lait noisettes El Inti BIO  100g";"DC-RO-UUN-NN-P";"Accueil";"2.47";"3.10";"";"14";
"Epice Scop";"Oui";"1086";"7753228001689";"";"Cacao CRU poudre Criollo 250g";"DC-RO-UUN-NN-P";"Chocolat";"3.88";"4.85";"";"16";
"Epice Scop";"Oui";"1088";"3760083930003";"";"Cidre brut ferme des landes 75cl";"DJ-RO-UUN-NN-P";"Accueil";"3.33";"4.15";"";"5";
"Epice Scop";"Oui";"1089";"";"";"Graines de tournesol décortiquées Europe sac 5kgs";"DF-RO-UUN-NN-P";"Graines";"14.55";"18.20";"";"0";
"Epice Scop";"Oui";"1090";"3267460030658";"";"Vermicelles blanches BIO 500g";"SP-RO-UUN-NN-P";"Accueil";"1.24";"1.55";"";"6";
"Epice Scop";"Oui";"1091";"3267460030214";"";"Torsades au lentilles vertes 250g*";"SP-RO-UUN-NN-P";"Pâtes, Riz, Autres céréales";"2.63";"3.30";"";"25";
"Epice Scop";"Oui";"1092";"3267460030191";"";"Torsades aux lentilles corail 250g*";"SP-RO-UUN-NN-P";"Pâtes, Riz, Autres céréales";"2.63";"3.30";"";"13";
"Epice Scop";"Oui";"1096";"8032738592122";"";"Vinaigre balsamique Guerzoni BIANCO 500ml*";"SH-RO-UUN-NN-P";"Accueil";"6.16";"7.70";"";"4";
"Epice Scop";"Oui";"1097";"3464932005101";"";"Moutarde aux 5 plantes BIO 200g";"SH-RO-UUN-NN-P";"Accueil";"2.57";"3.20";"";"6";
"Epice Scop";"Oui";"1098";"3464932008102";"";"Moutarde miel et épices BIO 200g";"SH-RO-UUN-NN-P";"Accueil";"2.32";"2.90";"";"6";
"Epice Scop";"Oui";"1099";"";"";"Farine de chataigne BIO 500g";"DG-RO-UUN-NN-P";"Accueil";"6.01";"7.70";"";"5";
"Epice Scop";"Oui";"1100";"3760060330239";"";"Farine de pois chiches BIO 800g";"DG-RO-UUN-NN-P";"Epicerie salée";"2.86";"3.60";"";"2";
"Epice Scop";"Oui";"1101";"3760060330130";"";"Farine de riz  saint joseph BIO 1kg";"DG-RO-UUN-NN-P";"Accueil";"2.84";"3.55";"";"3";
"Epice Scop";"Oui";"1140";"3000001235101";"";"Trio de Riz de camargue VRAC- servi par unités de 330g";"VS-RN-UUN-NN-N";"Accueil";"1.24";"1.65";"";"10";
"Epice Scop";"Oui";"1141";"3000001235064";"";"Couscous semi'complet  VRAC- servi par unités de 350g";"VS-RN-UUN-NN-N";"Accueil";"0.77";"0.90";"";"35";
"Epice Scop";"Oui";"1142";"3000001235071";"";"Coquillettes  blanches  VRAC- servies par unités de 310g";"VS-RN-UUN-NN-N";"Accueil";"0.64";"0.93";"";"83";
"Epice Scop";"Oui";"1145";"3000001235095";"";"Lentilles vertes  VRAC- servi par unités de 370g";"VS-RN-UUN-NN-N";"Accueil";"1.12";"1.90";"";"38";
"Epice Scop";"Oui";"1175";"3760258900060";"";"Café moulu Honduras Marcala coopérative Comsa  250g";"DT-RO-UUN-NN-P";"Accueil";"3.06";"3.85";"";"5";
"Epice Scop";"Oui";"1176";"3760258900121";"";"Café grain Colombie Excelso coopérative Asopep  1kg";"DT-RO-UUN-NN-P";"Accueil";"12.23";"15.30";"";"1";
"Epice Scop";"Oui";"1178";"";"";"Noisettes VRAC- servi par unités de 230g";"VD-RN-UUN-NN-N";"Accueil";"3.15";"3.95";"";"11";
"Epice Scop";"Oui";"1179";"";"";"Amandes VRAC- Tuono cal 36-38 servi par unités de 260g";"VD-RN-UUN-NN-N";"Accueil";"3.41";"4.25";"";"33";
"Epice Scop";"Oui";"1180";"3267460030306";"";"Torsades de pois chiche  250g*";"SP-RO-UUN-NN-P";"Pâtes, Riz, Autres céréales";"2.63";"3.30";"";"10";
"Epice Scop";"Oui";"1253";"";"";"Torsades semi completes  VRAC  150G";"VS-RN-UUN-NN-N";"Pâtes, Riz, Autres céréales";"0.00";"0.43";"";"41";
"Epice Scop";"Oui";"1382";"3421557111044";"";"Corn flakes nature - 500g Grillon d'or";"DP-RO-UUN-NN-P";"Céréales et galettes";"2.78";"3.50";"";"2";
"Epice Scop";"Oui";"1384";"3760108730069";"";"La Chikolodenn Rillettes de Sardines aux condiments - 90g";"SH-RO-UUN-NN-P";"Accueil";"2.60";"3.25";"";"4";
"Epice Scop";"Oui";"1385";"3760108730045";"";"La Chikolodenn Rillettes de Cabillaud au gingembre confit   90g";"SH-RO-UUN-NN-P";"Accueil";"2.60";"3.25";"";"12";
"Epice Scop";"Oui";"1399";"3328400862347";"";"Pruneaux d'Agen dénoyautés gros cal - 250g";"DF-RO-UUN-NN-P";"Accueil";"2.24";"2.80";"";"3";
"Epice Scop";"Oui";"1400";"3760059611028";"";"Vin AOC Ventoux rouge L'Homme de Cœur - bouteille 75 cl";"SA-RO-UUN-NN-P";"Accueil";"5.73";"7.20";"";"6";
"Epice Scop";"Oui";"1401";"3760039080028";"";"Vin blanc Origine IGP Gard - bouteille 75 cl";"SA-RO-UUN-NN-P";"Accueil";"4.74";"5.85";"";"6";
"Epice Scop";"Oui";"1402";"3760071500393";"";"Polenta instantanée - 500g carret munos";"SR-RO-UUN-NN-P";"Accueil";"1.26";"1.60";"";"12";
"Epice Scop";"Oui";"1403";"3760248980256";"";"Purée de pois chiche au cumin pour l’apéritif - 180g a cote";"SF-RN-UUN-ON";"Epicerie salée";"2.44";"3.05";"";"3";
"Epice Scop";"Oui";"1449";"3770011552542";"";"Vin rosé Syrah Quiétude - bouteille 75 cl";"SA-RO-UUN-NN-P";"Accueil";"4.74";"5.90";"";"2";
"Epice Scop";"Oui";"1450";"3546581250177";"";"Chips nature paille  Family chips - 125g";"SR-RO-UUN-NN-P";"Epicerie salée";"1.79";"2.25";"";"0";
"Epice Scop";"Oui";"1453";"8032738592214";"";"Crème de balsamique - Guerzoni 250ml";"SH-RO-UUN-NN-P";"Accueil";"5.09";"6.35";"";"3";
"Epice Scop";"Oui";"1488";"3760258900275";"";"Figues séchées variété Smyrna - 250g";"DF-RO-UUN-NN-P";"Epicerie sucrée";"2.37";"2.95";"";"2";
"Epice Scop";"Oui";"1489";"3760013115302";"";"Verveine bio de la Drôme  35g Tisane Le Dauphin";"DT-RO-UUN-NN-P";"Thés et Infusions";"2.63";"3.30";"";"7";
"Epice Scop";"Oui";"1490";"3760013115517";"";"Zénitude 70g Tisane Le Dauphin";"DT-RO-UUN-NN-P";"Accueil";"4.11";"5.15";"";"6";
"Epice Scop";"Oui";"1491";"3760013115524";"";"Détox Pure -70g Tisane La Dauphin";"DT-RO-UUN-NN-P";"Accueil";"4.11";"5.15";"";"5";
"Epice Scop";"Oui";"1492";"3770014430113";"";"Gressins à l'huile d'olive - 200g Malvi";"SS-RO-UUN-NN-P";"Accueil";"1.96";"2.45";"";"9";
"Epice Scop";"Oui";"1493";"3770014430120";"";"Gressins au sésame - 200g Malvi";"SS-RO-UUN-NN-P";"Accueil";"1.96";"2.45";"";"10";
"Epice Scop";"Oui";"1550";"";"";"Lentilles corail VRAC- servi par unités de 350g";"VS-RN-UUN-NN-N";"Accueil";"1.28";"1.60";"";"40";
"Epice Scop";"Oui";"1600";"3760060330031";"";"Farine de blé T110  1kg  Moulin Saint Joseph";"DG-RO-UUN-NN-P";"Epicerie salée";"1.62";"2.05";"";"2";
"Epice Scop";"Oui";"1601";"3760060330123";"";"Farine de blé 5 céréales   1kg  Moulin Saint Joseph";"DG-RO-UUN-NN-P";"Accueil";"2.32";"2.90";"";"5";
"Epice Scop";"Oui";"1608";"3760108730311";"";"La Chikolodenn Rillettes de langoustines - verrine 90g";"SH-RO-UUN-NN-P";"Accueil";"4.04";"5.05";"";"2";
"Epice Scop";"Oui";"1625";"3760011131014";"";"Route des Comptoir Thé vert Chun Mee – 100g";"DT-RN-UUN-NN-N";"Thés et Infusions";"3.79";"4.75";"";"7";
"Epice Scop";"Oui";"1626";"3760011131021";"";"Route des Comptoir Thé vert Gunpowder – 100g";"DT-RN-UUN-NN-N";"Thés et Infusions";"3.69";"4.60";"";"2";
"Epice Scop";"Oui";"1627";"3760011132011";"";"Route des Comptoir Thé noir Breakfast – 100g";"DT-RN-UUN-NN-N";"Thés et Infusions";"3.28";"4.10";"";"4";
"Epice Scop";"Oui";"1628";"3760011132059";"";"Route des Comptoir Thé noir Darjeeling Ambootia – 100g";"DT-RN-UUN-NN-N";"Thés et Infusions";"4.20";"5.30";"";"1";
"Epice Scop";"Oui";"1678";"3760258900220";"376025890022";"Café grain Ethiopie Sidamo   1kg";"DT-RO-UUN-NN-P";"Accueil";"14.70";"18.45";"";"3";
"Epice Scop";"Oui";"1683";"";"";"Riz  long semi-complet  de Camargue  VRAC vendu par unité de 350gr";"VS-RN-UUN-NN-N";"Epicerie salée";"1.25";"1.55";"kg";"14";
"Epice Scop";"Oui";"1685";"";"";"Pistaches coques grillées et salées  servi par unités de 210g";"VD-RN-UUN-NN-N";"Accueil";"4.70";"5.88";"";"28";
"Epice Scop";"Oui";"1686";"";"";"Noix de cajou au naturel W320 servi par unités de 240g VRAC";"VD-RN-UUN-NN-N";"Epicerie sucrée";"3.10";"3.90";"";"16";
"Epice Scop";"Oui";"1714";"3760011131779";"";"Route des Comptoir Thé vert Un des sens Gingembre citron badiane - 100g";"DT-RN-UUN-NN-N";"Thés et Infusions";"4.06";"5.05";"";"3";
"Epice Scop";"Oui";"1715";"3760011131250";"";"Route des Comptoir  ÉVASION Thé vert bio menthe, mangue, citron - 100g";"DT-RN-UUN-NN-N";"Thés et Infusions";"4.06";"5.05";"";"3";
"Epice Scop";"Oui";"1716";"3760011132264";"";"Route des Comptoir  Thé noir Earl Grey bergamote  - 100g";"DT-RN-UUN-NN-N";"Thés et Infusions";"3.69";"4.60";"";"4";
"Epice Scop";"Oui";"1717";"3760011132271";"";"Route des Comptoir  Thé noir Goût Russe 4 agrumes  - 100g";"DT-RN-UUN-NN-N";"Thés et Infusions";"3.43";"4.30";"";"5";
"Epice Scop";"Oui";"1718";"3760013115500";"";"Digest plus 70g  Tisane Le Dauphin";"DT-RO-UUN-NN-P";"Accueil";"4.11";"5.15";"";"7";
"Epice Scop";"Oui";"1719";"";"";"Pois chiche bio   VRAC- servi par unités de 400g";"VS-RN-UUN-NN-N";"Accueil";"1.25";"1.55";"";"46";
"Epice Scop";"Oui";"1720";"";"";"Penne semi complètes   VRAC- servi par unités de 140g";"VS-RN-UUN-NN-N";"Accueil";"0.00";"0.40";"";"12";
"Epice Scop";"Oui";"1721";"3760156640334";"";"Gaspacho Bio 1l Délices du Maraîcher  bouteille en verre 1l";"SC-RO-UUN-NN-P";"Accueil";"3.53";"4.40";"";"10";
"Epice Scop";"Oui";"1778";"5201203030060";"";"Huile d'olive BIO bidon métal  de 5L";"SH-RO-UUN-NN-P";"Accueil";"32.72";"40.10";"litre";"2";
"Epice Scop";"Oui";"1779";"3770014430113";"";"Gressins aux olives - 200g Malvi";"SS-RO-UUN-NN-P";"Accueil";"2.45";"3.10";"";"6";
"Epice Scop";"Oui";"1825";"3176800001848";"";"Agar-agar bio - 5 sachets de 4g";"DS-RO-UUN-NN";"Aide culinaire sucré";"2.11";"2.65";"";"15";
"Epice Scop";"Oui";"1826";"";"";"Flocons de quinoa bio - 350 g SALDAC";"DP-RO-UUN-NN-P";"Accueil";"4.06";"5.10";"";"7";
"Epice Scop";"Oui";"1831";"3421557701344";"";"petits Flocons avoine 500 g Grillon d'or";"DP-RO-UUN-NN-P";"Accueil";"1.49";"1.85";"";"5";
"Epice Scop";"Oui";"1832";"";"";"Arachides coques grillées vendues en VRAC au Kg";"VS-RN-UUN-NN-N";"Graines";"5.85";"8.20";"";"3";
"Epice Scop";"Non";"1087";"5201203070189";"";"Raisins de Corinthe AOP BIO 200g";"DF-RO-UUN-NN-P";"Accueil";"1.79";"2.25";"";"10";
"Epice Scop";"Non";"1094";"5201892042238";"";"Olives noires AOC  Bio  Bocal 240g";"SS-RO-UUN-NN-P";"Accueil";"2.02";"2.55";"";"0";
"Epice Scop";"Non";"1143";"3000001235088";"";"Noisettes Grillées  VRAC- servi par unités de 255g";"VD-RN-UUN-NN-N";"Accueil";"3.47";"4.33";"";"18";
"Epice Scop";"Non";"1144";"3000001235057";"";"Haricots blancs  VRAC- servi par unités de 260g";"VS-RN-UUN-NN-N";"Accueil";"0.00";"0.50";"";"4";
"Epice Scop";"Non";"1181";"3847800000093";"";"Olives noires entières variété cailletier Champsoleil- 130g";"SS-RO-UUN-NN-P";"Accueil";"2.65";"3.35";"";"0";
